{
  "schema": "https://ifandonlyif.io/schemas/service-receipt-key-directory-v2.json",
  "issuer": "https://ifandonlyif.io",
  "enabled": true,
  "keys": [
    {
      "key_id": "sha256:70be5c7a580fd0d89b34c4be79ed73fb7036ed3fb696223a1e271f61b9dcc217",
      "algorithm": "ML-DSA-65",
      "public_key": "YQsbUmXkmZlTRNIRqxyVvHQnF86-zeVqYmc1sdIjnm3zhnHetp1w4SUZq910hd6EbGeECwJNjVc_TNCmDXsgdn7RZ7e3P66o16GLGwfod4PTWmQ_JHSzCqdYOVOynl-jkJWRH9F6CpZ1L1gg8-WKUf7LzQlCNOnbpjrYghyRLu4b9BL21UV7d0b5ayOvPUN42kjNKoBObKmWoumo-KxQ_-dHpo1mVDsVlduo_xhi7Ja93YF1fiE3qFd5lW2SDdlObFXqcYYtYOVe8I01eTAO4wtNBrGklxck2k-SVG9jlOSLtPZgdruvSxYPRGzx_ND3SAGyKJUv-JAszBI0HCzzMOYn9uMNKKPSh_xR680p5mDbAtlJ6YSioytrqq755MXfpPYugRFlLJIGKQOP2iYJWK0Ivq6U17odFdMl6aju1JR8xt00OR1c2GhCN7724-pTZBf2NY8GN-DpKjOBUMkr7B3fEPzbiIKNJ0fDTLnJGKUhN1tfLr0j0Y5aDJuqySDnR4i09uEknzFIxRuRfzAFcQkw4-QrNYegmU-6aL8BiLcDKRqQfM77smo7IW5MEHrmgiIlFzLD3fnw1rleTCi9J5Kbx3FR-Ovh3DfV7q34IE9j2RiEbFTQf76MHRvPf1qgbBPc1npYZ87u2vwCYTWupcRx8wwVRv9qOLXx3S1c-nRAH9-g6rOzRLJ1l2UWLPxQD5iuhUSR_Fj5LuLokyEzTAHASMCxvJbBr0xAFKQShi0sRv2PhhRJ707U_HSOgfbe13BsndW0MoEnHvF9-belUt-hclscO0dC-2MmohoVoGzQTCgeRbIufoRNltroPOho_LmJ2409vGB-nL3paw3GesH8GPtLprDRP6n4SIjF8iy9t_i75mkgfcX8qwD2N0A9guy4eY7Ocy_4NJF53G-JlPGjbkx2qj5z7e3H3nEQ30vm--wQTRPG00MM5MFHoEfJgaV0PJPtKWMfjxgKq0DfdfrxPs0x-ksdEWbH5UPZWwzM1mYwIXbQwY7diYGETbwny-4Ekwuq9pDS9YZ50H4Z_CNmQsLMHrUukTqJswOJR4L4L5RuZ_CgwXtsySFbagSegLh72FZAkMVp5NBk3jwv5tNPQDTBSLliclsqpQMctzPPnoctbzYPe59jFFzgqfNlrJ08O_Z6ISx3jTdc7RzB0Ok1bCuhgV6tH8ew6MV8MJDoGPNyiYZGVA6hQTiZgB00UO5x8FMysuG8e4hg7QG3T87FhqVl-bgC6BW8pkHzEUswniAM7OH-nAwyTWnSiOuKs4b9mxOL6FbImJ7dgC00kfj_gLuO0Oh4qD3RyhuYFEr2WFcYJhq5AgPJMLt_go9y141bl4l_UfDOWQQeirGYDv9pSPOu66iqifDs2nKBPSR1A8Kw5wfycGaVy4yq2Y3CSYLuavM7cF6IRuwn-MwG2kK6u7Il0vU92dtuIDMdmAO5pdAkfnvI-tStHOSambW9yvOTLsfvRivjKfoL9r6wq3GTfE-W_d6cQz_FQqRaGSWYFFfYuX2e3GqA8CRB27NAeP9itf7ZRAu-Ujelp_2sZUF8OE51nd4U-zGAXJon-e6qyxlmpUu57HCs72R6asWvWeNdNJrF6L6drUQOUbtl0iVxwS0KIHNUVTiwBEeKMoja6K4dX-vB_fWIVi-MjcosItqjvMKqbT59pmDUC4CkSejk0xJbOOjooTrU3YTdqcZd8qf_E5iBr_eswoN4pUw6CvKjA3nuZDHYGLgpw0TnlBi8rceEKI_X-s9XD6z0muJB5D6dVW1e6aGaYSLSL_2k3dyTxd-WXpGdd0H2ZtWn2pPP8WnaZfdr8xRyIXjdcZZ0nRHntfP0oZrOeWXREJoBkRRYQ0lmct7WjoxImbuR-Kx_FMTIfdZ45sPi3ckXh54W4drAlbcDqlUGvC-u9MFyNU2wE7ncIYACvW1DWmdaqNpI98eyw9-K8OLzAh5FyJ1sCZaGsNNYVd97nO8SSmcGpjGCdJdnlJbUMZSHBfNg8remdJfV0XH-32vKFSKLIW9pvyqdPNeqBLrgpXFC3Y-dGjtfmQHCf2fQM1lDgKD_X279yEnVbosl5FdII2IP1uU3AiEigdy8qt38sW6Rnc3iz7cAvViO_E4w2D54fPBqmzO34_NZ4WZqToADtMEC8ZKkhOadW9Vui9Woif6qLLgSJqmMNigoSaYXI1sUPgkeh34i6Yucgy2PDieGGKZ_NuguV4qiLG57Zn0UaHgWms8haNw2IizIrZqOocDehzpRWMTNB8ullFRG08pB9c186HA09sQUvKAbn5ad9fZtg2pL7tsuJbyJq9BN8sxbu3x212xhDl6ScKr_AZ5cNsx5IPpLGlIuJPC0787cKlIiHcqwx6H3_nfF969PuWEcZxXY_HGZxE6McgpJIA8UtruhX-6p0KTQ6nrpPZrOjHizyRpMXOP2SLRGh2aKPBfvcLsangpwSby4iiylRK1deLo0vmJ3JWBFi1bUFFBnnXszn4rOoIrhNghpcXzvsGhl2G07Apd9-fq4MmymX3_rWBjkBda-lgOsl8Tso072x946TCj2St-hEM-jjTo1cRwJVmW05nyKSXDZUneVM7ixBwJhru0",
      "purpose": "service-receipt-signing",
      "status": "current"
    },
    {
      "key_id": "sha256:0f872f79cd935ac2d764589c8283d35ae0ca02780faebee8862db85348fc5ceb",
      "algorithm": "Ed25519",
      "public_key": "iVnUmYYy_PO_M3wFYWwc91wxVPU6VRyEcPr9iC4F230",
      "purpose": "service-receipt-signing",
      "status": "previous"
    }
  ]
}
